{"schemaVersion":1,"artifactType":"cross-source-analysis-plan","generatedAt":"2026-09-17T10:00:00Z","planId":"cross-source-plan-example123","planSha256":"d237c85ba177a1ab9662fce91ee213426ce832a8f170494bc6a5f3bb287f9f27","projectRoot":"C:\\projects\\example","request":{"requestId":"cross-source-request-example123"},"sources":{"ga4":{"reportId":"report-example"},"searchConsole":{"reportId":"search-console-report-example"}},"analyses":["overview-handoff"],"expectedDatasets":["ga4:google-organic-overview","search-console:overview"],"periods":{"current":{"from":"2026-08-17","to":"2026-09-13"},"previous":{"from":"2026-07-20","to":"2026-08-16"}},"boundaryAlignment":"date_labels_only","mappingPolicy":{"revision":"cross-source-url-v1","exactOnly":true},"rowBounds":{"maxPageMappings":500},"blockers":[],"limitations":[],"networkUsed":false,"mutationPerformed":false}
